{
  "paymentBalanceAmount": -51475814,
  "id": "est Duis elit commodo sit",
  "unappliedDate": "1965-06-08",
  "invoiceBalanceAmount": 97919405,
  "paymentApplicationType": "esse cupidatat ut eu",
  "appliedDate": "1975-05-31",
  "effectiveDate": "1943-05-15",
  "appliedAmount": -71682709,
  "externalCreatedDate": "1948-04-09",
  "payment": [
    "minim ea"
  ],
  "hasBeenUnapplied": null,
  "paymentInvoiceApplicationType": "incididunt est",
  "commentText": "voluptate ut ex cillum incididunt",
  "name": "do aliqua officia",
  "paymentInvoiceApplicationName": "aute"
}
